{
  "$schema": "https://json-schema.org/draft/2020-12/schema",
  "$id": "https://game-automation.local/contracts/v1/ui-theme",
  "type": "object",
  "properties": {
    "default_mode": {
      "enum": ["dark", "light"]
    },
    "tokens": {
      "type": "object",
      "properties": {
        "font-sans": {
          "type": "string"
        },
        "font-mono": {
          "type": "string"
        },
        "radius-sm": {
          "type": "string"
        },
        "radius-md": {
          "type": "string"
        },
        "radius-lg": {
          "type": "string"
        },
        "space-1": {
          "type": "string"
        },
        "space-2": {
          "type": "string"
        },
        "space-3": {
          "type": "string"
        },
        "space-4": {
          "type": "string"
        },
        "space-5": {
          "type": "string"
        },
        "space-6": {
          "type": "string"
        },
        "duration-fast": {
          "type": "string"
        },
        "duration-normal": {
          "type": "string"
        },
        "duration-enter": {
          "type": "string"
        },
        "motion-distance": {
          "type": "string"
        },
        "font-body": {
          "type": "string",
          "minLength": 1
        },
        "font-display": {
          "type": "string",
          "minLength": 1
        },
        "sidebar-width": {
          "type": "string",
          "minLength": 1
        },
        "duration-navigation": {
          "type": "string",
          "minLength": 1
        }
      },
      "required": [
        "font-mono",
        "radius-sm",
        "radius-md",
        "radius-lg",
        "space-1",
        "space-2",
        "space-3",
        "space-4",
        "space-5",
        "space-6",
        "duration-fast",
        "duration-normal",
        "duration-enter",
        "motion-distance"
      ],
      "additionalProperties": false,
      "anyOf": [
        {
          "required": ["font-body"]
        },
        {
          "required": ["font-sans"]
        }
      ]
    },
    "themes": {
      "type": "object",
      "properties": {
        "dark": {
          "$ref": "#/$defs/palette"
        },
        "light": {
          "$ref": "#/$defs/palette"
        }
      },
      "required": ["dark", "light"],
      "additionalProperties": false
    },
    "appearance": {
      "type": "object",
      "properties": {
        "font_size": {
          "type": "integer",
          "minimum": 14,
          "maximum": 22
        },
        "min_font_size": {
          "type": "integer",
          "minimum": 12,
          "maximum": 16
        },
        "max_font_size": {
          "type": "integer",
          "minimum": 18,
          "maximum": 28
        },
        "design_font_size": {
          "type": "integer",
          "minimum": 12,
          "maximum": 20
        },
        "minimum_text_ratio": {
          "type": "number",
          "minimum": 0.7,
          "maximum": 1
        },
        "reduce_motion": {
          "type": "boolean"
        }
      },
      "required": [
        "font_size",
        "min_font_size",
        "max_font_size",
        "design_font_size",
        "minimum_text_ratio",
        "reduce_motion"
      ],
      "additionalProperties": false
    }
  },
  "required": ["default_mode", "tokens", "themes"],
  "additionalProperties": false,
  "$defs": {
    "palette": {
      "type": "object",
      "properties": {
        "bg": {
          "type": "string"
        },
        "surface": {
          "type": "string"
        },
        "surface-raised": {
          "type": "string"
        },
        "surface-hover": {
          "type": "string"
        },
        "border": {
          "type": "string"
        },
        "text": {
          "type": "string"
        },
        "muted": {
          "type": "string"
        },
        "accent": {
          "type": "string"
        },
        "accent-soft": {
          "type": "string"
        },
        "positive": {
          "type": "string"
        },
        "warning": {
          "type": "string"
        },
        "negative": {
          "type": "string"
        },
        "info": {
          "type": "string"
        },
        "shadow": {
          "type": "string"
        },
        "overlay-contrast": {
          "type": "string",
          "minLength": 1
        }
      },
      "required": [
        "bg",
        "surface",
        "surface-raised",
        "surface-hover",
        "border",
        "text",
        "muted",
        "accent",
        "accent-soft",
        "positive",
        "warning",
        "negative",
        "info",
        "shadow",
        "overlay-contrast"
      ],
      "additionalProperties": false
    }
  }
}
