{
  "default_mode": "dark",
  "tokens": {
    "font-mono": "'Cascadia Code', 'SFMono-Regular', Consolas, monospace",
    "radius-sm": "2px",
    "radius-md": "3px",
    "radius-lg": "4px",
    "space-1": "4px",
    "space-2": "8px",
    "space-3": "12px",
    "space-4": "16px",
    "space-5": "24px",
    "space-6": "32px",
    "duration-fast": "500ms",
    "duration-normal": "600ms",
    "duration-enter": "600ms",
    "motion-distance": "0px",
    "font-body": "Cambria, Georgia, 'Times New Roman', serif",
    "font-display": "Georgia, 'Times New Roman', serif",
    "sidebar-width": "288px",
    "duration-navigation": "160ms"
  },
  "themes": {
    "dark": {
      "bg": "#0a090d",
      "surface": "#141017",
      "surface-raised": "#211627",
      "surface-hover": "#2d1b3d",
      "border": "#65502a",
      "text": "#f0e4cd",
      "muted": "#c3b38e",
      "accent": "#dfbf63",
      "accent-soft": "#2d1b4e",
      "positive": "#b9bb83",
      "warning": "#d2a65e",
      "negative": "#ef9b8a",
      "info": "#b9a3cf",
      "shadow": "0 8px 26px #00000050",
      "overlay-contrast": "#ffffff"
    },
    "light": {
      "bg": "#e7ddc7",
      "surface": "#f1e7d2",
      "surface-raised": "#e5d7bc",
      "surface-hover": "#ded0b5",
      "border": "#a68b57",
      "text": "#261b28",
      "muted": "#65513c",
      "accent": "#725219",
      "accent-soft": "#ddcbaa",
      "positive": "#54522b",
      "warning": "#85551a",
      "negative": "#8b1a1a",
      "info": "#5d3b78",
      "shadow": "0 8px 24px #34202a18",
      "overlay-contrast": "#ffffff"
    }
  },
  "appearance": {
    "font_size": 16,
    "min_font_size": 14,
    "max_font_size": 22,
    "design_font_size": 14,
    "minimum_text_ratio": 0.75,
    "reduce_motion": false
  }
}
